{
  "id": "app/search",
  "name": "Search Screen",
  "description": "Search screen with recent searches, query input and results list.",
  "version": "0.1.0",
  "framework": "react-native",
  "runtime": "expo",
  "typescript": true,
  "supported": {
    "styling": ["nativewind", "stylesheet"],
    "router": ["expo-router"],
    "ui": ["native"],
    "icons": ["lucide", "none"]
  },
  "dependencies": [
    "lucide-react-native"
  ],
  "devDependencies": [],
  "files": [
    {
      "path": "app/search/index.tsx",
      "when": { "router": ["expo-router"], "ui": ["native"] },
      "templateFile": "app/search/app.search.index.hbs"
    }
  ],
  "variants": [],
  "tags": ["app", "search"],
  "primitives": []
}