{
  "id": "onboarding/features",
  "name": "Features Onboarding Screen",
  "description": "Onboarding screen with selectable feature cards and continue action.",
  "version": "0.1.0",
  "framework": "react-native",
  "runtime": "expo",
  "typescript": true,
  "supported": {
    "styling": ["nativewind", "stylesheet"],
    "router": ["expo-router"],
    "ui": ["native"],
    "icons": ["lucide", "none"]
  },
  "dependencies": [
    "lucide-react-native"
  ],
  "devDependencies": [],
  "files": [
    {
      "path": "app/onboarding/features.tsx",
      "when": { "router": ["expo-router"], "ui": ["native"] },
      "templateFile": "onboarding/features/app.features.index.hbs"
    }
  ],
  "variants": [],
  "tags": ["onboarding", "features", "intro"],
  "primitives": []
}