{
  "id": "dashboard/analytics",
  "name": "Analytics Dashboard Screen",
  "description": "Dashboard with stat cards, chart placeholders, and recent activity list.",
  "version": "0.1.0",
  "framework": "react-native",
  "runtime": "expo",
  "typescript": true,
  "supported": {
    "styling": ["nativewind", "stylesheet"],
    "router": ["expo-router"],
    "ui": ["native"],
    "icons": ["lucide", "none"]
  },
  "dependencies": [
    "lucide-react-native"
  ],
  "devDependencies": [],
  "files": [
    {
      "path": "app/dashboard/index.tsx",
      "when": { "router": ["expo-router"], "ui": ["native"] },
      "templateFile": "dashboard/analytics/app.dashboard.index.hbs"
    }
  ],
  "variants": [],
  "tags": ["dashboard", "analytics", "stats", "charts", "metrics"],
  "primitives": []
}
